{
  "$schema": "https://json-schema.org/draft/2020-12/schema",
  "type": "object",
  "required": [
    "schema_version",
    "task_id",
    "work_revision",
    "workflow_decision_hash",
    "status",
    "checks",
    "workspace",
    "workspace_summary",
    "recorded_at"
  ],
  "properties": {
    "schema_version": {
      "type": "integer",
      "enum": [
        3
      ]
    },
    "task_id": {
      "type": "string",
      "minLength": 1,
      "maxLength": 64,
      "pattern": "[A-Za-z0-9][A-Za-z0-9._-]{0,63}"
    },
    "work_revision": {
      "type": "integer",
      "minimum": 1
    },
    "status": {
      "type": "string",
      "enum": [
        "PASS",
        "FAIL",
        "BLOCKED"
      ]
    },
    "checks": {
      "type": "array",
      "minItems": 1,
      "items": {
        "type": "object",
        "required": [
          "name",
          "status",
          "evidence"
        ],
        "properties": {
          "name": {
            "type": "string",
            "minLength": 1
          },
          "status": {
            "type": "string",
            "enum": [
              "PASS",
              "FAIL",
              "BLOCKED"
            ]
          },
          "evidence": {
            "type": "string",
            "minLength": 1
          }
        },
        "additionalProperties": false
      }
    },
    "workspace": {
      "type": "object",
      "required": [
        "files"
      ],
      "properties": {
        "files": {
          "type": "array",
          "minItems": 1,
          "items": {
            "type": "object",
            "required": [
              "path",
              "size",
              "sha256"
            ],
            "properties": {
              "path": {
                "type": "string",
                "minLength": 1
              },
              "size": {
                "type": "integer",
                "minimum": 0
              },
              "sha256": {
                "type": "string",
                "pattern": "[0-9a-f]{64}"
              }
            },
            "additionalProperties": false
          }
        },
        "worktree": {
          "type": "object",
          "required": [
            "task_id",
            "path",
            "branch",
            "base_commit",
            "head_commit",
            "workflow_decision_hash",
            "repo_path"
          ],
          "properties": {
            "task_id": {"type": "string", "minLength": 1},
            "path": {"type": "string", "minLength": 1},
            "branch": {"type": "string", "minLength": 1},
            "base_commit": {"type": "string", "minLength": 1},
            "head_commit": {"type": "string", "minLength": 1},
            "workflow_decision_hash": {"type": "string", "minLength": 1},
            "repo_path": {"type": "string", "pattern": "^\\.$"}
          },
          "additionalProperties": false
        }
      },
      "additionalProperties": false
    },
    "workspace_summary": {
      "type": "string",
      "minLength": 1
    },
    "recorded_at": {
      "type": "string",
      "minLength": 1
    },
    "workflow_decision_hash": {
      "type": "string",
      "pattern": "[0-9a-f]{64}"
    },
    "plan_task_id": {
      "type": "string",
      "minLength": 1,
      "maxLength": 64,
      "pattern": "[A-Za-z0-9][A-Za-z0-9._-]{0,63}"
    },
    "plan_bundle_hash": {
      "type": "string",
      "pattern": "[0-9a-f]{64}"
    },
    "plan_review_hash": {
      "type": "string",
      "pattern": "[0-9a-f]{64}"
    },
    "acceptance_ids": {
      "type": "array",
      "minItems": 1,
      "uniqueItems": true,
      "items": {"type": "string", "minLength": 1, "maxLength": 128, "pattern": "[A-Za-z0-9][A-Za-z0-9._:-]{0,127}"}
    }
  },
  "additionalProperties": false
}
